Title,Year,Author,Publisher,Page Number,Type,Text Content,Figure Number,Image Key,Image URL,Image Description
Hymenoptera of the World,1993,John I Huber,HOTWPublisher,46,Text,"subgenal carina A ridge bordering the gena subocular groove A groove extending from the
ventrally; it extends from the hypostomal carina ventral margin of the eye to the anterior or
to the anterior or facial articulation of the facial articulation of the mandible.
mandible.
suture A line or membranous area on the cuticle",NA,NA,NA,NA
Hymenoptera of the World,1993,John I Huber,HOTWPublisher,46,Text,"submentum The basal sclerite of the labium indicating the junction of two formerly separate
articulating apically with the mentum; in plates or sclerites (see also groove).
Apoidea, an often V-shaped sclerite (often
called the lorum) with an arm articulating with =,
each cardo and medially articulating with the A Ze,
mentum. ~ L\ if SS
\X
Kl
7 LZ",NA,NA,NA,NA
Hymenoptera of the World,1993,John I Huber,HOTWPublisher,46,Text,"mentum. ~ L\ if SS
\X
Kl
7 LZ
° ° tarsomere A subdivision of the tarsus; each tarsus
has 3-5 tarsomeres.
submetapleural carina A ridge on the ventral
margin of the lower part of the metapleuron,
between the bases of the mesocoxae and
metacoxae.
tarsus (pl., tarsi; adj., tarsal) The fifth segment of
Wax £ A a leg, attached basally to the tibia and
x) i cI > ty subdivided into tarsomeres.
( ye",NA,NA,NA,NA
Hymenoptera of the World,1993,John I Huber,HOTWPublisher,46,Text,"( ye
cNH\) : ——
57",NA,NA,NA,NA
Hymenoptera of the World,1993,John I Huber,HOTWPublisher,47,Text,"tegula (pl., tegulae) A small, scale-like sclerite tibia (pl., tibiae; adj., tibial) The fourth segment
covering the base of the fore wing, basal to the of a leg, between the femur and the tarsus.
humeral plate. .
wry Kel AS TD “a Wh
RY tibial spur A spine-like, multicellular extension of
the cuticle connected to an appendage by a",NA,NA,NA,NA
Hymenoptera of the World,1993,John I Huber,HOTWPublisher,47,Text,"tergite A sclerotized subdivision of a tergum socket; usually found apically on the tibiae.
bounded by grooves, or membranous lines or
areas (see also laterotergite, tergum).
tergum (pl., terga; adj., tergal) A dorsal sclerite of
a body segment, which may be subdivided into
tergites; specifically used for the
abdomen/metasoma (see also laterotergite).",NA,NA,NA,NA
Hymenoptera of the World,1993,John I Huber,HOTWPublisher,47,Text,"torulus (pl., toruli) A paired socket on the front
_ of the head upon which the scape is articulated.
L re ZZ | oS
\ \ f_\
QZ
: . a transscutal articulation A line of weakness across
thorax (pl., thoraces; adj., thoracic) The principal F
middle division of the body to which the legs the mesonotum between the fore wing bases,",NA,NA,NA,NA
Hymenoptera of the World,1993,John I Huber,HOTWPublisher,47,Text,"are attached, between the head and abdomen which secondarily separates the posterolater
(cf mesosoma) angles of the mesoscutum beside the scutellum
° . (see also axilla, scutum).
og? =
PIS
= <S. Mes
y trochantellus The basal end of the femur; it looks
een eae like a second segment of the trochanter.
thyridium See gastrocoelus.
58",NA,NA,NA,NA
Hymenoptera of the World,1993,John I Huber,HOTWPublisher,48,Text,"trochanter The second segment of a leg, between vertex The top of the head between the eyes, from
the coxa and femur. the anterior margin of the median ocellus to
the occiput.
truncate Cut off squarely at the tip. @ ® \ x
tubular vein A pigmented wing vein that is hollow \ J \ U. fay
and therefore appears darker laterally and C2) cava,
lighter medially; it can be seen with both QQZ7 -",NA,NA,NA,NA
Hymenoptera of the World,1993,John I Huber,HOTWPublisher,48,Text,"reflected and transmitted light (cf. nebulous,
spectral veins). _
uncus In Chalcidoidea, a short, narrow stub near volsella (pl., volsellae) . A paired, median inner
the apex of the stigmal vein directed towards appendage of the male genitalia.
the postmarginal vein.
vein (adj., veinal) Narrow, usually dark id
thickenings of a wing arising at the wing base
and branching towards the apex (see also",NA,NA,NA,NA
Hymenoptera of the World,1993,John I Huber,HOTWPublisher,48,Text,"nebulous, spectral, tubular veins, and
morphology section for naming of veins).
59",NA,NA,NA,NA
