Title,Year,Author,Publisher,Page Number,Type,Text Content,Figure Number,Image Key,Image URL,Image Description
Hymenoptera of the World,1993,John I Huber,HOTWPublisher,1,Text,"Minister of Supply and Services Canada 1993
Available in Canada through

Associated Bookstores

and other booksellers

or by mail from

Canada Communication Group — Publishing
Ottawa, Canada K1A 0S9

Cat. No. A53-1894/1993E

ISBN 0-660-14933-8",NA,NA,NA,NA
Hymenoptera of the World,1993,John I Huber,HOTWPublisher,1,Text,"ISBN 0-660-14933-8

Canadian Cataloguing in Publication Data
Hymenoptera of the world : an identification guide
to families / edited by Henri Goulet, John T. Huber. —
(Publication , 1894/E)

Includes bibliographical references and index.
Cat. No. A53-1894/1993E

ISBN 0-660-14933-8",NA,NA,NA,NA
Hymenoptera of the World,1993,John I Huber,HOTWPublisher,1,Text,"ISBN 0-660-14933-8

1. Hymenoptera—Identification. I. Goulet, Henri.
II. Huber, John T. Il. Canada. Agriculture
Canada. Research Branch. IV. Series: Publication
(Canada. Agriculture Canada). English ; 1894/E.
QL566.H9 1993 595.79 C93-099003-X
Cover illustration

Palaeomymar sp. (male)

Line drawing by Henri Goulet

Figure Editors

Louise Dumouchel

H. Eugene Bisdee

Staff Editor

Frances Smith",NA,NA,NA,NA
Hymenoptera of the World,1993,John I Huber,HOTWPublisher,2,Text,"Chapter 3 Structure
John T. Huber and Michael J. Sharkey
General comments
This guide is intended to familiarize the reader Includes a detailed discussion of terms used in
with the families of Hymenoptera, not hymen- chalcidoid taxonomy.
opteran morphology. We therefore attempt to use
the simplest acceptable terms for structures. Terms Gauld, I., and B. Bolton, eds. 1988. The",NA,NA,NA,NA
Hymenoptera of the World,1993,John I Huber,HOTWPublisher,2,Text,"used in the keys are defined and illustrated in the Hymenoptera. Oxford University Press,
glossary. A brief overview of hymenopteran Oxford, England. xi + 332 pp.
morphology, accompanied by labeled drawings of Includes a chapter on the morphology of
bodies and wings representing some major groups Hymenoptera.
of Hymenoptera, is given to orient the reader and ; .",NA,NA,NA,NA
Hymenoptera of the World,1993,John I Huber,HOTWPublisher,2,Text,"put into perspective many of the terms used. Gibson, G.A.P. 1985. Some pro- and mesothoracic
When the reader goes beyond this guide to structures important for phylogenetic analysis
identify specimens to the level of genus or species, a of Hymenoptera, with a review of terms for the
plethora of other, often synonymous, morphological structures. Canadian Entomologist",NA,NA,NA,NA
Hymenoptera of the World,1993,John I Huber,HOTWPublisher,2,Text,"terms will be encountered. In part, this occurs 117:1395— 1443.
because over many years various terms have been A review and reinterpretation of thoracic
replaced by more exact or more generalized terms structure and a discussion of synonymous terms
and different terms have been applied to applied to them.
homologous structures in various groups. ;",NA,NA,NA,NA
Hymenoptera of the World,1993,John I Huber,HOTWPublisher,2,Text,"Consequently, any given structure may have several Hélldobler, B., and E.O, Wilson. 1990. The ants.
names applied to it, and one term may apply to The Belknap Press of Harvard University Press,
several distinct structures, This confusion is Cambridge, Massachusetts, USA. 732 pp.
nowhere more apparent than in names applied to Includes a detailed section on morphology of",NA,NA,NA,NA
Hymenoptera of the World,1993,John I Huber,HOTWPublisher,2,Text,"the wing veins, where several major systems are ants.
used.
It is beyond the scope of this guide to define all Michener, C.D. 1944. Comparative external
terms as they have been applied to structures within morphology, phylogeny, and a classification of
Hymenoptera. The following annotated list of the bees (Hymenoptera), Bulletin of the",NA,NA,NA,NA
Hymenoptera of the World,1993,John I Huber,HOTWPublisher,2,Text,"references will help the interested reader. American Museum of Natural History
82:151-326.
Bohart, R.M., and A.S. Menke. 1976. Sphecid wasps Includes a detailed section on morphology of
of the world: a generic revision. University of bees.
ciulfornia Press, Berkeley, California, USA. ix + Nichols, S.W,, comp. 1989. The Torre-Bueno
PP- glossary of entomology. The New York",NA,NA,NA,NA
Hymenoptera of the World,1993,John I Huber,HOTWPublisher,2,Text,"The morphology chapter, especially the Entomological Society, New York, New York,
sections on wing venation and the lists of USA. 840 pp.
aetk ona for vte Py terms, is useful to all who The most comprehensive reference book in
work on aculeate Hymenoptera. English for entomological terms.
Brothers, ee ere Phylogeny and Classification of Richards, O.W. 1977. Hymenoptera: introduction",NA,NA,NA,NA
Hymenoptera of the World,1993,John I Huber,HOTWPublisher,2,Text,"Fovence to Mullins Ur with speci’ and key to families. Second edition. Handbooks
Se ‘ence B i tin 50-483. “8 oases for the identification of British insects. Vol. 6,
erence BUNCEN LU:405— 046. Part 1. Royal Entomological Society of London,
Includes the first cladistic analysis of Aculeata, London, England. 100 pp.
with a detailed discussion of characters. A detailed overview of hymenopteran",NA,NA,NA,NA
Hymenoptera of the World,1993,John I Huber,HOTWPublisher,2,Text,"Boutek, Z. 1988. Australasian Chalcidoidea morphology and terminology.
(Hymenoptera): a blosystematic revision of Ronquist, F, and G. Nordlander. 1989. Skeletal
eeclacaifi oan amv ae 4 ional morphology of an archaic cynipoid, Ibalia
Walline sd Fy ° 7 a 83D -A.B. International, rufipes (Hymenoptera: Ibaliidae). Entomologica
allingford, England. 832 pp. scandinavica, Supplement No. 33. 60 pp.
13",NA,NA,NA,NA
Hymenoptera of the World,1993,John I Huber,HOTWPublisher,3,Text,"A detailed account of one species, including a horizontally and at right angles to the long axis of
discussion of its structure and terms used in the body, regardless of its natural orientation in the
relation to other Hymenoptera. living insect or its position in a mounted specimen.
. ve ce There are only eight descriptors of position",NA,NA,NA,NA
Hymenoptera of the World,1993,John I Huber,HOTWPublisher,3,Text,"Ross, H.H. 1937. A generic classification of the used in the keys, though these are combined in
Nearctic sawflies (Hymenoptera, Symphyta). various ways when necessary, e.g., anterodorsal,
Illinois biological monographs 15(2). 173 pp. posterolateral.
Aref f .
reference for sawfly morphology anterior Toward or at the head end of the body or",NA,NA,NA,NA
Hymenoptera of the World,1993,John I Huber,HOTWPublisher,3,Text,"Snodgrass, R.E. 1935. Principles of insect structure (front, frontal).
morphology. McGraw-Hill, New York, New posterior ‘Toward or at the hind end of the body
York, USA. ix + 667 pp. or structure (rear, back).
A general work on insect morphology. dorsal Toward or at the top or upper surface of
Townes, H.K. 1969. The genera of Ichneumonidae, the body or structure (above).",NA,NA,NA,NA
Hymenoptera of the World,1993,John I Huber,HOTWPublisher,3,Text,"Part I. Memoirs of the American yentral Toward or at the bottom or lower surface
Entomological Institute. Number 11. American of the body or structure (below).
Entomological Institute, Gainesville, Florida, medial/median Toward or at the centre, or central
USA, 300 pp. area or line, of the body or structure (middle,
Includes an illustrated glossary of terms used mid).",NA,NA,NA,NA
Hymenoptera of the World,1993,John I Huber,HOTWPublisher,3,Text,"for ichneumonids. lateral Toward or at the side of the body, or the
margin or edge of a structure.
Body orientation and refationship of parts For the appendages (mouthparts, antennae,
Hymenoptera should be mounted in a uniform wings, legs, genitalia) additional descriptors are:
manner for study. Small specimens are mounted on apical The end farthest away from the body",NA,NA,NA,NA
Hymenoptera of the World,1993,John I Huber,HOTWPublisher,3,Text,"triangular or rectangular cards, glued to the right “at ort he tip (distal
side of the thorax so that the dorsal, ventral, and (apex); at or toward the tip (distal).
left sides of the body are clearly visible. Larger basal The end closest to the body (base); at or
specimens are pinned through the mesoscutum toward the base (proximal).
slightly to the right of the midline or are glued by Th : :",NA,NA,NA,NA
Hymenoptera of the World,1993,John I Huber,HOTWPublisher,3,Text,". . : terms basal and apical as applied to the
whe right Side ore thor axto the side of a pin. thorax—mesosoma have been used in the literature
emer p ne fac prot 7 ft he of the with the thorax—abdomen (mesosoma—metasoma)
ceecined j sa ali ° Whe twhen it . in dorsal junction as the central reference point. However, to",NA,NA,NA,NA
Hymenoptera of the World,1993,John I Huber,HOTWPublisher,3,Text,"examinec in lateral view. When examined in dorsa avoid confusion in this publication and to eliminate
view, positional terms used in the keys are based on the need for a reference point, these two terms are
the assumption that the head of the specimen faces not used for the body; instead, anterior and
away from the observer, and the wings are stretched posterior are used , ,",NA,NA,NA,NA
Hymenoptera of the World,1993,John I Huber,HOTWPublisher,3,Text,"out either horizontally away from the body or The prefix sub- may be added to describe an
vertically above the body. . attribute near the extremes, e.g., subapical,
Accurate descriptions of structures and their sublaterall
positions relative to one another are essential for Len ath, width, and height (not depth) and their",NA,NA,NA,NA
Hymenoptera of the World,1993,John I Huber,HOTWPublisher,3,Text,"clear understanding and must be consistent in keys corresponding adjectives (long, wide, high) are used
and descriptions. The terms of relative positions when giving measurements or proportions of a
used in this publication are illustrated (Fig. 1) and structure. Depth is used only when describing how
defined below. Because cep eae nd h ae deep a pit is or when describing certain types of",NA,NA,NA,NA
Hymenoptera of the World,1993,John I Huber,HOTWPublisher,3,Text,"bent i t ing On Wale t ihe dk ibe fe an ‘te uw h sculpture. Further information on orientation is
ent, It Is conventent to describe features of eac given in Mackerras (1970) and Scholtz and Holm
part of any leg as though it were extended (1985)
Morphology
Head, antennae, and mouthparts
(Figs. 6-10, 13, 14)
The head is the anterior division of the insect and the mouthparts directed ventrally",NA,NA,NA,NA
Hymenoptera of the World,1993,John I Huber,HOTWPublisher,3,Text,"body. It is shaped like a rectangular six-sided box (bypognathous). The position of various parts is
with its longitudinal axis usually oriented vertically described for a head oriented in this manner. The
14",NA,NA,NA,NA
Hymenoptera of the World,1993,John I Huber,HOTWPublisher,4,Text,"head is divided into six areas, which are sometimes entire area (excluding the postocciput) above the
further subdivided (Figs. 6—9). The relative size of foramen, and the gena as the entire area lateral to
these areas varies greatly and is often defined and and below the foramen. The hypostoma is a narrow
demarcated somewhat differently among the sclerite bordering the oral cavity posteriorly and",NA,NA,NA,NA
Hymenoptera of the World,1993,John I Huber,HOTWPublisher,4,Text,"various groups of Hymenoptera. Useful reference separated from the gena and postgena by the
points are the toruli anteriorly, compound eyes hypostomal carina.
laterally, three ocelli dorsally, foramen magnum The antennae (Fig. 14) are a paired structure
posteriorly, and oral cavity ventrally. The rim of the composed, from the base, of three segments: scape,",NA,NA,NA,NA
Hymenoptera of the World,1993,John I Huber,HOTWPublisher,4,Text,"foramen magnum is articulated with the propleura, pedicel, and flagellum (Fig. 13). The flagellum is
connecting the head to the rest of the body. usually secondarily divided into two or more",NA,NA,NA,NA
Hymenoptera of the World,1993,John I Huber,HOTWPublisher,4,Text,"The anterior surface of the head from the oral flagellomeres. The scape is attached to the front of
cavity to the anterior ocellus and between the the head by a socket (torulus). Between the socket
compound eyes is the face (Fig. 6). The face is and base of the scape there is often a short, narrow",NA,NA,NA,NA
Hymenoptera of the World,1993,John I Huber,HOTWPublisher,4,Text,"usually subdivided into at least three areas: clypeus, radicle that sometimes is distinctly differentiated
face (in the narrow sense) and frons. The clypeus from the scape. The radicle is a part of the scape
(not to be confused with the labrum) is the ventral and is not counted as a separate segment.
area, immediately above the margin of the oral The mouthparts (Figs. 6, 9, 10) surround the",NA,NA,NA,NA
Hymenoptera of the World,1993,John I Huber,HOTWPublisher,4,Text,"cavity. The dorsolateral corners, or lateral margins, oral cavity anpd are composed of four externally
of the clypeus include the anterior tentorial pits, visible components. From anterior to posterior
which are small, often inconspicuous pits located on these components include the following: labrum
either side. A clearly visible to inconspicuous line (usually hidden behind the clypeus), paired",NA,NA,NA,NA
Hymenoptera of the World,1993,John I Huber,HOTWPublisher,4,Text,"(epistomal groove) between and below the pits mandibles, paired maxillae, and labium. Each
indicates the dorsal and lateral margins of the maxilla may be subdivided into cardo, stipes,
clypeus. The face (in the narrow sense) is the lacinia, and galea. The labium may be subdivided
medial area, above and sometimes beside the into submentum, mentum, prementum, glossa, and",NA,NA,NA,NA
Hymenoptera of the World,1993,John I Huber,HOTWPublisher,4,Text,"clypeus. The dorsal margin of the face is defined by paraglossa. Both the maxillae and the labium bear
an imaginary transverse line at the level of the segmented palpi.
ventral margins of the toruli (antennal sockets).
The frons is the dorsal area, above the face. The
dorsal margin of the frons is defined by an Thorax/mesosoma and legs",NA,NA,NA,NA
Hymenoptera of the World,1993,John I Huber,HOTWPublisher,4,Text,"imaginary transverse line between the compound (Figs. 2-5, 11, 12)
eyes at the level of the anterior margin of the
median ocellus. The thorax is the middle division of the insect",NA,NA,NA,NA
Hymenoptera of the World,1993,John I Huber,HOTWPublisher,4,Text,"The dorsal surface of the head, between the body. It can be imagined as a six-sided rectangular
dorsal margins of the compound eyes and including box with its long axis oriented horizontally. It is
the ocelli, is the vertex (Figs. 7, 8). The vertex is composed of three segments: prothorax,
defined anteriorly by the dorsal margin of the frons mesothorax and metathorax. When wings are",NA,NA,NA,NA
Hymenoptera of the World,1993,John I Huber,HOTWPublisher,4,Text,"and posteriorly by the occipital carina or groove. If present, the first pair (fore wings) is on the
there is no ridge or groove, the vertex is defined mesothorax, and the second pair (hind wings) is on
posteriorly either by an imaginary line between the the metathorax. In members of the suborder
compound eyes at the level of the posterior margins Symphyta the first segment of the abdomen is",NA,NA,NA,NA
Hymenoptera of the World,1993,John I Huber,HOTWPublisher,4,Text,"of the lateral ocelli, or by the highest point of the similar to the remaining segments; there is no
head behind the lateral ocelli if the ocelli are lower distinct constriction between the first and second
than the area of the head posterior to them. segments (Figs. 2, 3). In members of the suborder",NA,NA,NA,NA
Hymenoptera of the World,1993,John I Huber,HOTWPublisher,4,Text,"The posterior surface of the head is divided Apocrita the first segment of the abdomen is widely
into five areas which may not all be present or well and immovably connected to the metathorax and
defined in a particular species: occiput, postocciput, usually narrowly and flexibly connected to the rest",NA,NA,NA,NA
Hymenoptera of the World,1993,John I Huber,HOTWPublisher,4,Text,"postgena, gena, and hypostoma (Figs. 8, 9). The of the abdomen (Figs. 4, 5). This first abdominal
occiput is the dorsal part between the occipital segment is the propodeum, and the apparent thorax
groove or carina, when present, and the (true thorax plus propodeum) is the mesosoma
postoccipital groove. The ventral part between (middle body).",NA,NA,NA,NA
Hymenoptera of the World,1993,John I Huber,HOTWPublisher,4,Text,"these two grooves is the postgena. The narrow Each segment of the thorax is divided into a
ring-like postocciput is between the postoccipital dorsal area (notum), lateral area (pleuron), and
groove and the foramen magnum. The gena is the ventral area (sternum). The notum and pleuron are
ventral or lateral area below and behind the eye usually large and may be further subdivided, but the",NA,NA,NA,NA
Hymenoptera of the World,1993,John I Huber,HOTWPublisher,4,Text,"and in front of the occipital groove, when present. sternum is undivided, reduced, and, on the
The gena is delimited anteriorly by an imaginary mesothorax and metathorax, considered to be
line between the ventral apex of the compound eye invaginated internally and represented only by a
and the anterior articulation of the mandible. If the median longitudinal line. From anterior to",NA,NA,NA,NA
Hymenoptera of the World,1993,John I Huber,HOTWPublisher,4,Text,"occipital groove or carina is absent, the occiput posterior the notum may consist of up to three
merges with the vertex and can be considered as the",NA,NA,NA,NA
Hymenoptera of the World,1993,John I Huber,HOTWPublisher,4,Text,15,NA,NA,NA,NA
Hymenoptera of the World,1993,John I Huber,HOTWPublisher,5,Text,"separate areas: scutum, scutellum, and postnotum. consists of a dorsal plate or tergum and a ventral
The pronotum is undivided (Figs. 2-5). The plate or sternum (Figs. 3, 5). There are no special
mesonotum is usually divided into mesoscutum and pleural sclerites, and a spiracle opens at the side of
mesoscutellum (Fig. 4), and, in the suborder one or more terga, which often extend ventrally to",NA,NA,NA,NA
Hymenoptera of the World,1993,John I Huber,HOTWPublisher,5,Text,"Symphyta, mesopostnotum (Fig. 2). The cover the lateral surfaces of the abdomen. If the
metanotum is not clearly divided or is undivided in terga and sterna are subdivided into smaller
Apocrita (Fig. 4), but in Symphyta it is usually sclerites, they are called tergites and sternites,
divided into the metascutum and the respectively.",NA,NA,NA,NA
Hymenoptera of the World,1993,John I Huber,HOTWPublisher,5,Text,"metascutellum (Fig. 2). A metapostnotum is Female Hymenoptera have an egg-laying
distinguishable in most families of Hymenoptera apparatus or ovipositor, which may be concealed or
though it is not clearly visible without dissection exposed, depending on the species. The ovipositor
(Whitfield et al. 1989). is protected by a pair of ovipositor sheaths (Figs. 2,",NA,NA,NA,NA
Hymenoptera of the World,1993,John I Huber,HOTWPublisher,5,Text,"The paired propleuron is undivided and 3). In aculeate Hymenoptera the ovipositor has
occupies the lateroventral area behind the head become modified exclusively for stinging and no
(Figs. 3, 5). The propleuron is usually loosely and longer functions for egg laying (Figs. 4, 5). The
flexibly connected to the pronotum and to the rest genitalia of male Hymenoptera are concealed and",NA,NA,NA,NA
Hymenoptera of the World,1993,John I Huber,HOTWPublisher,5,Text,"of the thorax. The fore leg is connected to the vary from simple, tubular structures with the parts
posteroventral apex of the propleuron. The greatly reduced, to relatively complex and elaborate
mesopleuron is the largest of the pleura and is structures.
usually subdivided into an anterior mesepisternum
and posterior mesepimeron (Figs. 3, 5), though the 1",NA,NA,NA,NA
Hymenoptera of the World,1993,John I Huber,HOTWPublisher,5,Text,"division may be very inconspicuous in some Wings
Apocrita. The metapleuron is small and may be (Figs. 13-19)
divided in the same way as the mesopleuron
(Figs. 3, 5). The system used here for naming wing veins
Any given sclerite of the thorax/mesosoma may and cells is the Comstock and Needham
be subdivided into named areas by grooves or (1898-1899) system updated by Comstock (1918),",NA,NA,NA,NA
Hymenoptera of the World,1993,John I Huber,HOTWPublisher,5,Text,"ridges, which also have specific names applied to Ross (1936) and others (see Mason 1990 for
them, but which may vary depending on the taxon. additional references). Unfortunately, there are
Terms applied to parts of the thorax/mesosoma are other systems employed by hymenopterists such as
therefore numerous and often confusing. the Rohwer-Gahan (1916) system widely used for",NA,NA,NA,NA
Hymenoptera of the World,1993,John I Huber,HOTWPublisher,5,Text,"A leg consists of six primary segments from the Ichneumonoidea. The authors of the chapters
base to apex: coxa, trochanter, femur, tibia, tarsus, on Apoidea, Chrysidoidea, and Vespoidea prefer a
and pretarsus (Fig. 11). The femur sometimes has a different system of naming wing cells. One reason
partial secondary division basally, the trochantellus, for this, given by Michener (p. 310 in this",NA,NA,NA,NA
Hymenoptera of the World,1993,John I Huber,HOTWPublisher,5,Text,"making it appear as though the trochanter is publication), is that it is sometimes impossible to
two-segmented. Each tibia usually has one or two determine the true origins of some wing cells. For
spurs apically. In many Hymenoptera one of the example, the three submarginal cells of most
protibial spurs is modified into a cleaning aculeate Hymenoptera are 1R1, 1Rs, and 2Rs.",NA,NA,NA,NA
Hymenoptera of the World,1993,John I Huber,HOTWPublisher,5,Text,"apparatus for the antenna. When the number is reduced to two, one cannot
The tarsus is secondarily subdivided into three determine whether the missing vein is the second
to five tarsomeres, cach of which may bear a ventral abscissa of Rs or Ir-m. Therefore, when naming
pad, the plantar lobe. The pretarsus (Fig. 12) these cells, the use of the generic term submarginal",NA,NA,NA,NA
Hymenoptera of the World,1993,John I Huber,HOTWPublisher,5,Text,"consists of two claws and associated structures. is more practical than the more specific terms 1R1,
1Rs and 2Rs. For comparison, the equivalent (when
aaa the complete complement of three cells is present)
Abdomen/metasoma and genitalia names of veins and cells used in the Comstock-
(Figs. 2-5) Needham system are tabulated in Chapter 7
(p. 130). For a comparison of the updated",NA,NA,NA,NA
Hymenoptera of the World,1993,John I Huber,HOTWPublisher,5,Text,"The abdomen is the posterior division of the Comstock-Needham system and other systems see
insect body. It can be imagined as a horizontal Day (1988).
cylinder. Primitively, the abdomen consists of 11 In many small parasitic Hymenoptera (e.g.,
segments, but because of fusion and loss usually no Chalcidoidea, Proctotrupoidea, Ceraphronoidea,",NA,NA,NA,NA
Hymenoptera of the World,1993,John I Huber,HOTWPublisher,5,Text,"more than 10 segments are visible. As discussed Platygastroidea, and some Chrysidoidea) the wing
above, in Apocrita the first abdominal segment is venation is very reduced, and a simplified
fused to the thorax as the propodeum and the nomenclature is used (Fig. 14). From the base of
remaining (usually nine) segments are collectively the wing the veins are submarginal, marginal, and",NA,NA,NA,NA
Hymenoptera of the World,1993,John I Huber,HOTWPublisher,5,Text,"called the metasoma (Figs. 4, 5). Each segment postmarginal; a stigmal vein branches posteriorly
1 The reader may find this section rather difficult, but do not despair; all veins and cells are well illustrated in the keys, and so it is not necessary
to understand the system of naming veins to key out a specimen.
16",NA,NA,NA,NA
Hymenoptera of the World,1993,John I Huber,HOTWPublisher,6,Text,"from the junction of the marginal and Crossveins, indicated by lowercase letters, take
postmarginalveins. The stigmal vein may be the name of the veins they connect, with the
knobbed apically as the stigma (see glossary), which anterior vein given first. Thus, a crossvein that
sometimes sends off a little stub, the uncus, toward connects R with M is r-m. If there are several r-m",NA,NA,NA,NA
Hymenoptera of the World,1993,John I Huber,HOTWPublisher,6,Text,"the postmarginal vein. The names of these veins do crossveins, they take numerical values as well, e.g.,
not connote any homology with similarly named 1r-m, 2r-m, and so on. If a crossvein joins two
veins in other Hymenoptera but are simply a branches of the same vein, the crossvein takes the
convenient system of naming veins that has name of the major longitudinal vein, e.g., a",NA,NA,NA,NA
Hymenoptera of the World,1993,John I Huber,HOTWPublisher,6,Text,"developed for these groups. The probable crossvein between R and Rs is called r-rs.
equivalents in the Comstock- Needham system are Two veins may fuse for part or all of their
given in parentheses in Fig. 14. length, appearing as one. The resulting vein takes
Another factor that complicates hymenopteran the name of both component veins joined by a plus",NA,NA,NA,NA
