Title,Year,Author,Publisher,Page Number,Type,Text Content,Figure Number,Image Key,Image URL,Image Description
MMD,2022,"Danforth, Bryan, et al.",MMDPublisher,42,Text,"tropical species; see also Janjic and Packer (2001). (couplets ## [2] and ## [4] in the Key to
Genera of Halictinae) ~
128. Lasioglossum Curtis: Minute to moderate-sized; andreniform [Figs. 441 and 442], males Ww
often slender; black or dull green or blue, in Antilles rarely bright green; metasoma sometimes",NA,NA,NA,NA
MMD,2022,"Danforth, Bryan, et al.",MMDPublisher,42,Text,"yellow to red but usually brown or occasionally dull metallic. Weakened distal veins of forewing ~
(Fig. ##) characteristic only of this genus. Weakening of veins often not or scarcely perceptible ~
in males. Basal tergal bands or basal lateral patches of pale hair (tomentum) commonly present Y
and pale hair may spread over much of tergal surface; apical bands, such as occur in Halictus, v",NA,NA,NA,NA
MMD,2022,"Danforth, Bryan, et al.",MMDPublisher,42,Text,"are not found in American Lasioglossum. Abundant, the most common genus of bees in most
north temperate localities; there are nearly 400 species in our area. Boreal to tropical ~
(cosmopolitan). The great majority of species have three submarginal cells but a few species (in Y
subgenera Dialictus, Habralictellus and Hemihalictus) have two submarginal cells. (couplets ## VY",NA,NA,NA,NA
MMD,2022,"Danforth, Bryan, et al.",MMDPublisher,42,Text,"[2] and ## [] in the Key to Genera of Halictinae) U
The subgeneric classification of Lasioglossum has been extraordinarily difficult to resolve and bed
highly unstable. Gibbs (Gibbs 2018 and Gibbs et al. 2013) recently developed a classification Y
based on a robust phylogeny for the genus that recognizes 8 subgenera in North America: U",NA,NA,NA,NA
MMD,2022,"Danforth, Bryan, et al.",MMDPublisher,42,Text,"Lasioglossum s.str., Leucalictus, Dialictus, Eickwortia, Evylaeus, Hemihalictus, Sphecodogastra,
and Habralictellus. The latter is likely a deriviative of Hemihalictus s.l. Socially parasitic species bal
previously placed in Paralictus are polyphletic and now included within Dialictus. In general, Y
the subgenera Dialictus, Evylaeus, and Sphecodogastra include many primitively eusocial ws",NA,NA,NA,NA
MMD,2022,"Danforth, Bryan, et al.",MMDPublisher,42,Text,"species whereas the other subgenera include mostly solitary species. Females in the vast majority
of Lasioglossum species nest in the soil but a few species of Dialictus have switched to nesting ~
in soft, pulpy, rotting wood (e.g., Lasioglossum [Dialictus] coeruleum). For keys to the species bd
within our area, see: McGinley (1986) for Lasioglossum sensu stricto; Gibbs (2010 and 2011) for w",NA,NA,NA,NA
MMD,2022,"Danforth, Bryan, et al.",MMDPublisher,42,Text,"Dialictus in Canada and eastern North America; Gardner and Gibbs (2020) for Dialictus in
western North America with pale metasoma; Gibbs et al. 2013 for Evvlaeus, Hemihalictus, and ~
Sphecodogastra (s.1.) in eastern North America; McGinley (2003) for nocturnal, crepuscular and =
matinal Sphecodogastra (s.str.). Caribbean species have been treated by island in several papers ~",NA,NA,NA,NA
MMD,2022,"Danforth, Bryan, et al.",MMDPublisher,42,Text,"by Gibbs, Genaro or Engel. YU
Key to the subgenera of Lasioglossum in North America (1/19/2022) i)
Modified from Michener (2007), McGinley (1986), and Gibbs et al. (2013). w
a. Second submarginal crossvein (1rs-m) as strong as first (second abscissa of Rs), difficult to ~
see in male; head and mesosoma black (except L. pavonotum (Cockerell)) ...c.ccccsscsessesseseesveseeseeeeeD ~",NA,NA,NA,NA
MMD,2022,"Danforth, Bryan, et al.",MMDPublisher,42,Text,"— Second submarginal crossvein (1rs-m) weaker than first (second abscissa of Rs), at least in ad
female; head and mesosoma variable in CO]OUL ....ccccesssesecessescsescecsescscscscscscscsssssssessssseseseveseeveseees€ ww
b(a). Propodeum with lateral carina well developed, reaching dorsal surface with the following ~",NA,NA,NA,NA
MMD,2022,"Danforth, Bryan, et al.",MMDPublisher,42,Text,"combination dorsal surface coarsely sculptured, shorter than scutellum; T1 without basal hair ha
band; head long (length/width ratio = 0.88—1.0); male gonostylus without retrorse lobe .........cs+0 w
sNbiSCaENaCosasacssueseenesorurncororcosnenensenenseeenenenessesunesnenensentscnossstiseduysvetosyensustasuastesreanrenvereavsedls | (LOUCHQLCHIS) vv
~~
—",NA,NA,NA,NA
MMD,2022,"Danforth, Bryan, et al.",MMDPublisher,43,Text,"— Propodeum with lateral carina usually poorly developed, not reaching dorsal surface, but if
~ strong then without combination above, i.e. dorsal surface longer than scutellum or weakly
~ sculptured or if strongly sculptured then T1 with basal hair band or head short (length/width ratio
os = 0.77-0.89); male gonostylus with retrorse lobe ........s cece eeeneteteteteteeeeeeeeeeeel, (Lasioglossum)",NA,NA,NA,NA
MMD,2022,"Danforth, Bryan, et al.",MMDPublisher,43,Text,"~ c(a). Head and mesosoma metallic (green, blue or golden), at least in part...
ha — Head and mesosoma black-brown .........csesesesseseseeseseeeesseeeseseeaesesnesesesaesesesaeaeenssesneneaeeteacacereseevee E
vw d(c). Head and mesosoma brilliant metallic (Caribbean); male inner metatibial spur typically",NA,NA,NA,NA
MMD,2022,"Danforth, Bryan, et al.",MMDPublisher,43,Text,"pectinate; male gonostylus without retrorse lobe... cece eeeeeeeeeeeteteeeeeeeeeeeeeLe (Habralictellus)
~ — Head and mesosoma dull metallic; male inner metatibial spur ciliate; male gonostylus with
w Tetrorse ]ODE oo... eeeesesessssescsesesesesesescscsesseeesesenesessusvacseseecsescaesesesenevaescseaceesasseaeeeetecaeaeeeeetetateeeeeee®",NA,NA,NA,NA
MMD,2022,"Danforth, Bryan, et al.",MMDPublisher,43,Text,"e(d). Body size usually small (4-6 mm); female T1 usually with appressed hairs at least laterally,
~ typically lacking erect hairs medially; female mandible almost always with small preapical tooth;
~ propodeum usually with weak lateral carina ..0......eeeeeeeeseeeeeeeeeeeeeteteteteeteeeeeeeee L (Dialictus)",NA,NA,NA,NA
MMD,2022,"Danforth, Bryan, et al.",MMDPublisher,43,Text,"~ — Body size usually larger (6-8 mm); female T1 without appressed hairs, medially with distinct
erect hairs; female mandible often strongly bidentate (primarily Mesoamerica except L. aquilae),
~ if preapical tooth small, then propodeum with strong lateral carina.................. L. (Eickwortia s.1.)",NA,NA,NA,NA
MMD,2022,"Danforth, Bryan, et al.",MMDPublisher,43,Text,"~ f (c). Head wide; female inner metatibial spur with fine oblique teeth, not as tall as width of main
‘oe rachis; male gonostylus without retrorse lobe; metasomal sterna with erect pubescence.................
en a neon nner merrier amen nee (EVIGEUS)
~ — Head usually longer; female inner metatibial spur usually with longer, narrow or fat teeth,",NA,NA,NA,NA
MMD,2022,"Danforth, Bryan, et al.",MMDPublisher,43,Text,"~ often taller than width of main rachis basally; male gonostylus with retrorse lobe; metasomal
Ww sterna, with variable pubescence. .......:csssessensesnvscsreesrsuowsnrsaotarsneneterensstanesnarerancnaserensenencraseneeetasreresrsneD
g(f). Female mandible strongly bidentate, subapical tooth nearly equal to apical one; male",NA,NA,NA,NA
MMD,2022,"Danforth, Bryan, et al.",MMDPublisher,43,Text,"~ gonobase at middorsum less than one-fourth length of gonocoxite (Mesoamerica) ........cccsecceeees
oad sesesevesesesesesesesesesessenenessuesesesececseneseueneseneneaeseseeeseaestenesneaeaeieseseneetetetssttsaeassseetesseee Le (Bickwortia 8.5.)
WY — Female mandible with small preapical tooth dorsally; male gonobase at middorsum usually",NA,NA,NA,NA
MMD,2022,"Danforth, Bryan, et al.",MMDPublisher,43,Text,"o more than one-third length of ZOMOCOXItC........ceeeseseseseseeessenessenenestencatensaescsseatsresestsecsessseseessseseeel]
~ h(g). Either propodeum with weak lateral carina and fully developed scopa or mesosoma
- coarsely sculptured on pleuron and carina appearing to reach dorsal surface; male metasomal",NA,NA,NA,NA
MMD,2022,"Danforth, Bryan, et al.",MMDPublisher,43,Text,"- sterna with erect pubecence; male antennae relatively short; male heads sometimes enlarged with
Tong mandibles... ees seseeeseseseseeeseseseeeesenesesesssessseensseteeetetsssssssstststssseseseseseseses Le (Hemihalictus)
~ — Either propodeum with weak lateral carina and highly modified reduced scopa or mesosoma",NA,NA,NA,NA
MMD,2022,"Danforth, Bryan, et al.",MMDPublisher,43,Text,"~ weakly rugose at most and propodeum with complete carina; male antennae relatively long; male
WY heads not enlarged... cececeseseseeeeeeeeseeseseseseseeeeesteteeeteeeeeteteeeeeeeed. (Sphecodogastra)
Y 129. Mexalictus Eickwort: Small to moderate sized (6-12mm in length); slender andreniform;
ka usually weakly metallic green, blue to purple, some extensively pale brown; integument dull,",NA,NA,NA,NA
MMD,2022,"Danforth, Bryan, et al.",MMDPublisher,43,Text,"finely roughened; wings elongate. Resembles rather large, slender species of Lasioglossum
~ (Dialictus) but differs in strong wing venation and serrate rather than pectinate inner hind tibial",NA,NA,NA,NA
MMD,2022,"Danforth, Bryan, et al.",MMDPublisher,44,Text,spur of female. Rare. Panama to southern Arizona in high elevation cloud forests ranging from,NA,NA,NA,NA
MMD,2022,"Danforth, Bryan, et al.",MMDPublisher,44,Text,"1600m-3500m in altitude (Eickwort 1978). Floral associations are poorly known. Revision: ~
Dumesh 2013. (couplets ## [2] and ## [@] in the Key to Genera of Halictinae) Y
Halictinae: Sphecodini ~
All members of the tribe Sphecodini are brood or social parasites of solitary, communal, and Y
primitively social bees (Danforth et al. 2019). Goncalves (2021) provides a revised generic ws",NA,NA,NA,NA
MMD,2022,"Danforth, Bryan, et al.",MMDPublisher,44,Text,classification of the tribe Sphecodini with a key to genera recognized in his classification. Our,NA,NA,NA,NA
MMD,2022,"Danforth, Bryan, et al.",MMDPublisher,44,Text,"classification differs, as noted below. ~",NA,NA,NA,NA
MMD,2022,"Danforth, Bryan, et al.",MMDPublisher,44,Text,"130. Microsphecodes Eickwort and Stage: Similar to minute Sphecodes in appearance but often UY
paler in color; sculpturing often weaker than usual in Sphecodes; free part of marginal cell three
times as long as part subtended by submarginal cells. Rare. Widespread in neotropical region, as al
far north as Guatemala (Packer et al. in press?). Brood parasites or social parasites in nests of ad",NA,NA,NA,NA
MMD,2022,"Danforth, Bryan, et al.",MMDPublisher,44,Text,"other small Halictini, namely Lasioglossum (Dialictus) and Habralictus. A phylogeny by we
Habermannovéa et al. (2013) suggests that Microsphecodes arose from within Austrosphecodes, a
Neotropical lineage of Sphecodes s./. Due to its current usage and distinctive form, we recognize ~
Microsphecodes here at the generic level until a more robust classification is available. Revision: nd",NA,NA,NA,NA
MMD,2022,"Danforth, Bryan, et al.",MMDPublisher,44,Text,None. (couplets ## [Q] and ## [<] in the Key to Genera of Halictinae) ~Y,NA,NA,NA,NA
MMD,2022,"Danforth, Bryan, et al.",MMDPublisher,44,Text,"131. Nesosphecodes Engel. Small to moderate-sized; andreniform; similar to Microsphecodes YU
but are generally larger, without yellow markings, and free part of marginal cell two times as
long as part subtended by submarginal cells. Rare. Three described species from the Greater ~
Antilles.. Revision: Engel (2006). ~

~~",NA,NA,NA,NA
MMD,2022,"Danforth, Bryan, et al.",MMDPublisher,44,Text,"132. Prilocleptis Michener: Small, andreniform; body black and extensively covered with pale
plumose hair; surface is less coarsely sculptured than usual in Sphecodes. Very rare; only one ~
described species in our area (Ptilocleptis tomentosa). Widespread in neotropics, north to Nuevo bad
Leon. Brood parasitic. Host-associations are poorly known but potentially attack Augochlorini w",NA,NA,NA,NA
MMD,2022,"Danforth, Bryan, et al.",MMDPublisher,44,Text,"(Michener 2007). Revision: Michener (1978). (couplets ## [2] and ## [<7] in the Key to Genera UY
of Halictinae)",NA,NA,NA,NA
MMD,2022,"Danforth, Bryan, et al.",MMDPublisher,44,Text,"133. Sphecodes Latreille: Minute to moderate-sized; andreniform [Fig. 444]; black with ~
metasoma partly or wholly red in females and many males; sparsely haired, terga shiny, without w
hair bands; punctation of most species very coarse, as is pitting at base of propodeum. Extremely
broad head (couplet 52) is distinctive. Common in temperate regions, uncommon in tropics. ~",NA,NA,NA,NA
MMD,2022,"Danforth, Bryan, et al.",MMDPublisher,44,Text,"Boreal to tropical, Canada to Panama and Antilles (cosmopolitan). Sphecodes s./. is rendered bad
paraphyletic by Microsphecodes and Eupetersia (Habermannové et al. 2013) and likely other w
taxa in the tribe. Austrosphecodes and Melissocleptis Goncalves (new synonymy) are included ie
within our Sphecodes s./. Some characters used to define Melissocleptis, like the short scape, also",NA,NA,NA,NA
MMD,2022,"Danforth, Bryan, et al.",MMDPublisher,44,Text,"occur in temperate species of Sphecodes. Brood parasites in nests of other Halictinae, less ~
commonly in nests of Andrena and Perdita. Revision: None. (couplets ## [2] and ## [] in the ww
Key to Genera of Halictinae) Ww",NA,NA,NA,NA
MMD,2022,"Danforth, Bryan, et al.",MMDPublisher,44,Text,"Most species have three submarginal cells, but a few have only two (couplet ##). Several
groups appear to be subgenerically distinct, but the subgenera remain unresolved. ~

ad
~~",NA,NA,NA,NA
MMD,2022,"Danforth, Bryan, et al.",MMDPublisher,45,Text,"~ Nomiinae

~ The subfamily Nomiinae includes solitary or communal, ground-nesting bees. They are most

‘oS diverse in the Old-World tropics with many genera in tropical Africa and Asia (Michener 2007).
In our area, we have only two genera: Dieunomia (tribe Dieunomiini) and Nomia (tribe

bead Nomiini). Bossert et al. (2021) published a phylogeny of Nomiinae which supports the two

ww tribes.",NA,NA,NA,NA
MMD,2022,"Danforth, Bryan, et al.",MMDPublisher,45,Text,"ww tribes.

~ 134. Dieunomia Cockerell: Moderate-sized to large; andreniform; usually with apical tergal hair

~ bands, without colored integumental bands; metasoma sometimes partly or wholly red. Common

a in central and southwestern USA, elsewhere uncommon. Nests excavated in soil, all oligolectic",NA,NA,NA,NA
MMD,2022,"Danforth, Bryan, et al.",MMDPublisher,45,Text,"+ on Asteraceae. Southern Canada, USA except northeast, south to Jalisco. Revision: Blair (1935)
for Dieunomia s.str., Cross (1958) for subgenus Epinomia. (couplet 36)

~ 135. Nomia Latreille: Moderate-sized to large; apiform or andreniform [Figs. 445 and 446];

ww somewhat hairy; terga without hair bands, with apical, hairless, blue, green, or yellowish",NA,NA,NA,NA
MMD,2022,"Danforth, Bryan, et al.",MMDPublisher,45,Text,"wv integumental bands. Nests excavated in soil, all polylectic. Nomia melanderi is managed for
alfalfa pollination. Common, western USA, elsewhere in our area uncommon. USA south to

- Veracruz and Guerrero, not or scarcely in tropics; Antilles (cosmopolitan except South America).

— Revision: Ribble (1965). (couplet 36)",NA,NA,NA,NA
MMD,2022,"Danforth, Bryan, et al.",MMDPublisher,45,Text,"oe Nomia and Dieunomia can be run through either couplets 35 or 121 in the Key to the Genera
because it is difficult to decide on the proper course at couplet 26.

ad Rophitinae
Members of the subfamily Rophitinae are distinct from other halictid bees in the placement of

~ the antennae low on the face (Michener 2007). They are all ground-nesting, solitary or",NA,NA,NA,NA
MMD,2022,"Danforth, Bryan, et al.",MMDPublisher,45,Text,"aad communal bees. Most species are narrow host-plant specialists on a variety of plant families (see

ww below). We follow the tribal classification of Patiny et al. (2008) below.

~ Rophitinae: Conanthalictini

~ 136. Conanthalictus Cockerell: Small to minute; andreniform; blackish or greenish, with dull,",NA,NA,NA,NA
MMD,2022,"Danforth, Bryan, et al.",MMDPublisher,45,Text,"wy minutely roughened, scarcely punctate integument. Rather uncommon. Texas, Utah to California
and Baja California Norte, principally on flowers of Hydrophyllaceae. Revision: Timberlake

(1961). (couplet 40)

~ Rophitinae: Rophitini

~ 137. Dufourea Lepeletier: Small to moderate-sized; andreniform [Figs. 447 and 448] to slender",NA,NA,NA,NA
MMD,2022,"Danforth, Bryan, et al.",MMDPublisher,45,Text,"= andreniform; black to metallic bluish or greenish, rarely with red metasoma, sometimes with pale

w tergal hair bands. Not uncommon in western and central USA, elsewhere rare. Canada, USA,

v Mexican desert and plateau south to Oaxaca (holarctic). North American species of Dufourea are
oligolectic on a wide variety of plant families including Asteraceae, Boraginaceae,",NA,NA,NA,NA
MMD,2022,"Danforth, Bryan, et al.",MMDPublisher,45,Text,"~ Campanulaceae, Caprifoliaceae, Hydrophyllaceae, Lamiaceae, Liliaceae, Malvaceae,",NA,NA,NA,NA
MMD,2022,"Danforth, Bryan, et al.",MMDPublisher,46,Text,"Phrymaceae, Polemoniaceae, Pontederiaceae, and Rosaceae. Revision: Canadian species,
Dumesh & Sheffield (2012). (couplet 188)",NA,NA,NA,NA
MMD,2022,"Danforth, Bryan, et al.",MMDPublisher,46,Text,"138. Micralictoides Timberlake: Small to minute; andreniform; sometimes with red metasoma, ww
without tergal hair bands. Uncommon. Nevada, Arizona, Southern California and no doubt yy
northern Baja California. Species are oligolectic on diverse host-plants, including Chaenactis
(Asteraceae), Allium (Amaryllidaceae), Gilia and Navarretia (Polemoniaceae), and =",NA,NA,NA,NA
MMD,2022,"Danforth, Bryan, et al.",MMDPublisher,46,Text,"Eschscholtzia (Papaveraceae) (Bohart and Griswold 1987). Revisions: Bohart (1942); Bohart and ~
Griswold (1987). (couplet 189) Wy
Rophitinae: Xeralictini ~",NA,NA,NA,NA
MMD,2022,"Danforth, Bryan, et al.",MMDPublisher,46,Text,"—

139. Protodufourea Timberlake: Small; andreniform. Rare. California and Arizona, may occur i,
in Baja California. Females are oligolectic on flowers of Phacelia and Emmenanthe yy
(Hydrophyllaceae). Revision: Timberlake (1955a). (couplet 39)

—",NA,NA,NA,NA
MMD,2022,"Danforth, Bryan, et al.",MMDPublisher,46,Text,"—

140. Sphecodosoma Crawford: Minute; andreniform; commonly with red metasoma in females. wy
Rare. Southeastern Kansas, Oklahoma, and western Texas to southern California, U.S,A., and ww
south to the state of Oaxaca, Mexico. Females are oligolectic on Nama (Hydrophyllaceae).

Revision: Timberlake (1961), as subgenus of Conanthalictus. (couplet 40) ~
~~",NA,NA,NA,NA
MMD,2022,"Danforth, Bryan, et al.",MMDPublisher,46,Text,"141. Xeralictus Cockerell: Large (11—12.5 mm); andreniform; blackish or partly reddish. Rare. ww
Deserts of California, Nevada, and Baja California. Females are oligolectic on Mentzelia and
Eucnide (Loasaceae). Revision: Snelling and Stage (1995b). (couplet 37) ~",NA,NA,NA,NA
MMD,2022,"Danforth, Bryan, et al.",MMDPublisher,46,Text,"-—
—
Family Megachilidae w
Proboscis as in Apidae. One subantennal suture. Facial fovea absent. Labrum longer than broad ~
and widened to broad articulation with clypeus. Two submarginal cells in forewing, usually ~
about equal in length. Pygidial plate usually absent. ww
—
NOTES ON THE BIOLOGY, PHYLOGENY, AND CLASSIFICATION. Megachilidae had",NA,NA,NA,NA
MMD,2022,"Danforth, Bryan, et al.",MMDPublisher,46,Text,"includes both solitary and brood parasitic groups. Among the solitary species there is an os
extraordinary diversity of nesting habits, including wood-nesters, stem and cavity nesters that use ee
leaves, flower petals, plant fibers, and resins to build their nests, and even above-ground builders
that use resins, sand, and stones (Danforth et al. 2019 provides an overview of the varied nesting -",NA,NA,NA,NA
MMD,2022,"Danforth, Bryan, et al.",MMDPublisher,46,Text,"habits in this family). Floral preferences range from broadly polylectic species to narrow host- ~
plant specialists. The phylogeny and classification of Megachilidae has undergone significant ed
revisions due to analyses of morphological and molecular data. Higher level classification was
revised by Litman et al. (2011) and Gonzalez et al. (2012). Generic relationships in Osmiini were ~",NA,NA,NA,NA
MMD,2022,"Danforth, Bryan, et al.",MMDPublisher,46,Text,"reanalyzed by Praz et al. (2008), in Anthidiini by Litman et al. (2016), and in Megachilini by =
Trunz et al. (2016) . We follow these studies in our classification of North and Central American ee
bees (Table 2-1). w
—
—
-—",NA,NA,NA,NA
MMD,2022,"Danforth, Bryan, et al.",MMDPublisher,47,Text,"~ Lithurginae

w 142. Lithurgopsis Fox: Moderate-sized to large, megachiliform [Figs. 451 and 452], females

'o usually and males sometimes with facial prominence at level of upper margin of clypeus; hind
tibia of female spiculate. Uncommon; usually in xeric areas; South Dakota to Costa Rica,

~ Antilles, continuing south in temperate regions to Argentina. Nests excavated in pithy stems or",NA,NA,NA,NA
MMD,2022,"Danforth, Bryan, et al.",MMDPublisher,47,Text,"~ soft wood. Oligolectic on Opuntia and similar cacti. Nests in burrows in wood. Revisions:

wv Snelling (1983, 1986b). (couplet 195)

~ 143. Lithurgus Latreille: Similar to Lithurgopsis. Lithurgus chrysurus is introduced from

~ Europe and now present in the eastern USA. Lithurgus chrysurus are specialists on Centaurea",NA,NA,NA,NA
MMD,2022,"Danforth, Bryan, et al.",MMDPublisher,47,Text,"vw (Asteraceae). Nesting biology and behavior of North American populations of Lithurgus
chrysurus have been described by Rozen and colleagues (Rust et al. 2004, Rozen 2013, Rozen &

~ Wyman 2014).

ie Megachilinae: Anthidiini

~ 144. Anthidiellum Cockerell: Moderate-sized, very robust megachiliform [Fig. 453], black or",NA,NA,NA,NA
MMD,2022,"Danforth, Bryan, et al.",MMDPublisher,47,Text,"~ sometimes red with yellow markings. Differs from all other North American anthidiines by

VW short, robust body. Uncommon in western USA, otherwise rare. Southern Canada, all parts of
USA and Mesoamerica, including the tropics (cosmopolitan except Australia, depending on

~ generic limits). Nests of resin constructed in the open. Our species are in the subgenus",NA,NA,NA,NA
MMD,2022,"Danforth, Bryan, et al.",MMDPublisher,47,Text,"~ Loyolanthidium Urban. Revisions: Schwarz (1926b), USA and Canadian species; Grigarick and

Ww Stange (1968), Californian species; Urban (2001) as Loyolanthidium. (couplet ## in Key to
Genera of Anthidiini)

~ 145. Anthidium Fabricius: Moderate-sized to large, broad-bodied, rather squarish",NA,NA,NA,NA
MMD,2022,"Danforth, Bryan, et al.",MMDPublisher,47,Text,"ww megachiliform [Fig. 454], with yellow markings, usually extensive. The multiple, close-set
mandibular teeth of the female distinguish this genus from all others in our area except the

i adventive Pseudoanthidium. Widely distributed from Canada, Alaska, southward through

~ western and central USA (adventive A. manicatum and A. oblongatum extend the range to the",NA,NA,NA,NA
MMD,2022,"Danforth, Bryan, et al.",MMDPublisher,47,Text,"~ east coast) and Mesoamerica; also present in South America (cosmopolitan except Australia).

U Nest cells of plant hairs in small cavities in wood, in stems, in or between stones, in soil or rarely
excavated in soil. All native species are in Anthidium s.str. Revisions: Grigarick and Stange

~ (1968), Californian species; Gonzalez and Griswold (2013), Western Hemisphere species.",NA,NA,NA,NA
MMD,2022,"Danforth, Bryan, et al.",MMDPublisher,47,Text,al (couplet ## in Key to Genera of Anthidiini),NA,NA,NA,NA
MMD,2022,"Danforth, Bryan, et al.",MMDPublisher,47,Text,"146. Anthodioctes Holmberg: Small (4.5-10.5 mm long) heriadiform to slender megachiliform
= bees, coarsely punctate with strongly developed carinae and foveae, dark species, usually with
™~ rather limited yellow markings. Uncommon. Neotropics, ranging into arid subtropics of Mexico,
ww north to Tamaulipas, Chihuahua, and Sinaloa. Resin nests in small pre-existing cavities in wood,",NA,NA,NA,NA
MMD,2022,"Danforth, Bryan, et al.",MMDPublisher,47,Text,"U stones, and so forth. Species in our area are all in the subgenus Anthodioctes s. str. Revisions:",NA,NA,NA,NA
MMD,2022,"Danforth, Bryan, et al.",MMDPublisher,47,Text,"Urban (1998, 1999). (couplet ## in Key to Genera of Anthidiini)",NA,NA,NA,NA
MMD,2022,"Danforth, Bryan, et al.",MMDPublisher,48,Text,"147. Austrostelis Michener and Griswold: Small heriadiform bees; flat projection at the apex of
the hind tibia of the female is a unique feature of this genus. Rare. This mostly South American ~
group ranges northward to central Mexico (San Luis Postosi). Austrostelis was originally treated ~
as a subgenus of Hoplostelis (Michener & Griswold 1994) but has since been elevated to generic S",NA,NA,NA,NA
MMD,2022,"Danforth, Bryan, et al.",MMDPublisher,48,Text,"status by Michener (2007). Like other brood parasitic anthidiines (Hoplostelis, Rhynostelis, and
Stelis), female Austrostelis lack a scopa. Hosts are largely unknown, except for one confirmed ~
record of Austrostelis catamarcensis emerging from nests of Epanthidium tigrinum (Zanella & ~
Ferreira 2005). Revision: Parizotto et al. (2018); see also Michener and Griswold (1994). vw",NA,NA,NA,NA
MMD,2022,"Danforth, Bryan, et al.",MMDPublisher,48,Text,"(couplet ## in Key to Genera of Anthidiini) VU
148. Aztecanthidium Michener and Ordway: Large, rather elongate megachiliform [Figs. 455 ~
and 456], black or red with limited yellow or whitish markings. Rare. Oaxaca to Puebla and ~
Nayarit. Revisions: Michener and Ordway (1964); Snelling (1987). (couplet ## in Key to Genera YJ
of Anthidiini) Y",NA,NA,NA,NA
