Title,Year,Author,Publisher,Page Number,Type,Text Content,Figure Number,Image Key,Image URL,Image Description
MMD,2022,"Danforth, Bryan, et al.",MMDPublisher,1,Text,"~ Chapter 4 — A primer on bee morphology

v [updated 6/28/2022]

~ In order to use the keys in this book effectively, it is important to become familiar with

~ the morphology of bees and the terms used to describe morphological features. With that goal in",NA,NA,NA,NA
MMD,2022,"Danforth, Bryan, et al.",MMDPublisher,1,Text,"iJ mind, we present below an overview of bee morphology and an introduction to the terms that are
used throughout the keys. We follow the terminology used in Michener (2007), which is based

~ on morphological studies of bees that date back to Michener’s PhD thesis (Michener 1944).

~ Additional key papers on bee morphology include Urban (1967), Camargo et al. (1967),",NA,NA,NA,NA
MMD,2022,"Danforth, Bryan, et al.",MMDPublisher,1,Text,"wv Eickwort (1969), Stephen et al. (1969), and Brooks (1988). The illustrations in this chapter are
redrawn from Michener (1944 and 1965a) and Danforth (1996). For a detailed look at the

~ internal and external anatomy of the honeybee (Apis mellifera), see Snodgrass (1956). For a

~ comprehensive and modern overview of general insect morphology, see Beutel et al. (2014).

¥ BODY REGIONS",NA,NA,NA,NA
MMD,2022,"Danforth, Bryan, et al.",MMDPublisher,1,Text,"¥ BODY REGIONS

= Before diving into the details, let’s consider a basic question. What do we call the three

~ body regions in bees? For most insects, the body is divided into three distinct regions: head,

iy thorax, and abdomen. The abdomen houses the reproductive, digestive, and excretory organs.
The thorax houses the leg and flight muscles, and the head bears the sensory organs and",NA,NA,NA,NA
MMD,2022,"Danforth, Bryan, et al.",MMDPublisher,1,Text,"~ mouthparts. However, in most Hymenoptera (bees included), the thorax and abdomen have been

ad reconfigured to such an extent that we cannot use these same terms. In Apocrita (= Hymenoptera

- with a narrow waist), the first abdominal segment has become attached to the posterior region of
the thorax and the narrow “waist” is actually a constriction between abdominal segments | and 2.",NA,NA,NA,NA
MMD,2022,"Danforth, Bryan, et al.",MMDPublisher,1,Text,"9 Therefore, in Apocrita, we need to use slightly different terms. In Apocrita we refer to the
“mesosoma” (= thorax plus first abdominal segment, or “propodeum”; Fig. 13) and “metasoma”

~ (= remaining abdominal segments). Thus, in bees, we refer to the three body regions as head,

~ mesosoma, and metasoma. The head and mesosoma are complex structures and we will cover",NA,NA,NA,NA
MMD,2022,"Danforth, Bryan, et al.",MMDPublisher,1,Text,"= those below. The metasoma, by contrast, is fairly simple consisting of dorsal sclerites (terga)
paired with ventral sclerites (sterna) to form a tube enclosing the internal organs plus genitalia.

~ For use of the keys, it will be important to identify specific metasomal terga or sterna. To do so,",NA,NA,NA,NA
MMD,2022,"Danforth, Bryan, et al.",MMDPublisher,2,Text,"we number terga and sterna of the metasoma starting with metasomal segment 1. Therefore, the

first metasoma tergum is T1, the second T2, and so forth. The same is true for sterna: the first ~
metasomal sternum is S1, the second S2, and so forth [Fig. 19]. Make sure that you are ~
comfortable with identifying specific metasomal terga and sterna when you start using the keys. wi",NA,NA,NA,NA
MMD,2022,"Danforth, Bryan, et al.",MMDPublisher,2,Text,"The sexes in bees are often quite different from one ~
another, and in parts of the keys the sexes are treated atl
separately. To people familiar with bees, males and females ~
can be distinguished most rapidly based on the overall shape ww
of the body — males are typically more slender than females
and they often have longer antennae. Also, the presence of a ~",NA,NA,NA,NA
MMD,2022,"Danforth, Bryan, et al.",MMDPublisher,2,Text,"distinct scopa will distinguish females from males in many ~
groups (excluding brood parasites, bees that carry pollen v
internally, and queens of advanced eusocial species). Finally,
females have stings, and males have male genitalia [Fig. 20]; ~
but both are commonly retracted, and in some females the ~
sting is rudimentary. Other features may need to be examined ¥",NA,NA,NA,NA
MMD,2022,"Danforth, Bryan, et al.",MMDPublisher,2,Text,"to verify the sex of an individual, including the number of
antennal segments and the number of visible metasomal ~
segments. Males have 13 antennal segments (12 in Neopasites ~
and Holcopasites);, females have 12 [Fig. 10]. In addition, ~
males and females typically differ in the number of visible ws
metasomal segments. In males, we can usually count seven",NA,NA,NA,NA
MMD,2022,"Danforth, Bryan, et al.",MMDPublisher,2,Text,"visible metasomal terga, whereas in females we can usually ~
count only six [Fig. 19]. But keep in mind that the last ad
segment, which often bears a pygidial plate, can be hidden. In ed
female Halictinae, for example, T6 is often hidden beneath
T5, so females appear to have just five visible terga. Likewise, ~
in some male bees it is difficult to see T7 because it is largely, ”",NA,NA,NA,NA
MMD,2022,"Danforth, Bryan, et al.",MMDPublisher,2,Text,"or rarely wholly, hidden beneath T6. In addition, in males of ~
some groups (e.g., Osmiini) the segments are greatly
telescoped and retracted so that the visible terga and sterna ~
can be reduced to as few as four visible sterna and terga. ~
HEAD CAPSULE (Figs 2-4, 10)",NA,NA,NA,NA
MMD,2022,"Danforth, Bryan, et al.",MMDPublisher,2,Text,"The malar area [Fig. 2] is the space between the eye and the mandible; its length is the =
shortest distance from the eye to the mandible [Fig. 4]; the width of this area is the width of the —
base of the mandible. The foveae (singular: fovea) of the face [Fig. 2] and of the sides of the
second metasomal tergum (T2) are shallow depressions, usually black in color, with a texture ~",NA,NA,NA,NA
MMD,2022,"Danforth, Bryan, et al.",MMDPublisher,2,Text,"distinct from the surrounding cuticle, and variable in shape. The term orbit is often used for the ~
eye margin, inner orbit for the frontal or facial margin, and outer orbit for the genal margin. The ~
genal area is the region behind the eye and in front of the preoccipital ridge [Figs. 3 and 4]. The v
ridge surrounding the concave posterior surface of the head above and laterally is called the",NA,NA,NA,NA
MMD,2022,"Danforth, Bryan, et al.",MMDPublisher,2,Text,preoccipital ridge [Fig. 3]. A carina sometimes found on this ridge is the preoccipital carina. The ~,NA,NA,NA,NA
MMD,2022,"Danforth, Bryan, et al.",MMDPublisher,3,Text,"~ proboscidial fossa is the large, deep groove on the
~ underside of the head into which the proboscis
~ folds [Fig. 3].
MOUTHPARTS (Figs. 5-9)
~ Bee mouthparts consist of paired mandibles
~ for chewing and a proboscis that can fold and
¥ unfold for lapping and sucking nectar. For the
names of mandibular structures [Fig. 5], we usually
~ follow Michener and Fraser (1978). For simplicity",NA,NA,NA,NA
MMD,2022,"Danforth, Bryan, et al.",MMDPublisher,3,Text,"~ we often refer to preapical teeth on the upper
7 margin instead of teeth of the pollex. Other terms used herein are the condylar ridge, which
arises near the mandibular condyle and extends toward the apex of the mandible, and the outer
~ ridge, which is the next ridge above the condylar ridge on the outer surface of the mandible.",NA,NA,NA,NA
MMD,2022,"Danforth, Bryan, et al.",MMDPublisher,3,Text,"~ The bee proboscis is a complex structure formed from a fusion of the maxilla and labium,
we which together make up the “labiomaxillary complex.” The maxilla consists of paired cardines
(singular: cardo) that suspend the labiomaxillary complex from beneath the head capsule, the
~ stipes, blade-like galea (plural: galeae), and the maxillary palpus (plural: palpi) with up to six",NA,NA,NA,NA
MMD,2022,"Danforth, Bryan, et al.",MMDPublisher,3,Text,"~ segments [Figs. 6, 7]. Attached at the apex of the
hs cardines is the labium, which consists of the lorum,
e mentum, prementum, tongue-like glossa, and (typically)
four-segmented labial palpus [Fig. 6]. In Colletidae the
~ glossa is quite different from that of other bees [Fig. 8,
~ 9]. Rather than being slender and elongate, as in most
ka other bee families, the colletid glossa is short and",NA,NA,NA,NA
MMD,2022,"Danforth, Bryan, et al.",MMDPublisher,3,Text,"bilobed (sometimes referred to as “bifid”). This
~ modification of the glossa is related to the application of
a the thick, cellophane brood cell lining that characterizes
~ colletid bees (Batra 1980).
Bees can be divided into two broad categories
~ based on mouthpart morphology: short-tongued bees
~ (Andrenidae, Halictidae, Colletidae, Stenotritidae, and",NA,NA,NA,NA
MMD,2022,"Danforth, Bryan, et al.",MMDPublisher,3,Text,"~ Melittidae), in which the labial palpal segments are all
v similar in morphology (Fig. 8), and long-tongued bees
(Apidae and Megachilidae), in which the first two labial
~ palpal segments are slender and blade-like (Fig. 6).
~ Danforth et al. (2019) provide a more detailed
_ description of the proboscis and how it functions.
The proboscis is typically folded beneath the",NA,NA,NA,NA
MMD,2022,"Danforth, Bryan, et al.",MMDPublisher,3,Text,"~ head capsule, making it very difficult to distinguish
~ among the complex and interconnected elements.
~ However, if the mouthparts are pulled before pinning, while the specimen is still flexible, the
o individual elements can be easily recognized. In some cases, it is necessary to examine the
maxillary and labial palpi and to count the number of palpal segments (e.g., in certain Eucerini).",NA,NA,NA,NA
MMD,2022,"Danforth, Bryan, et al.",MMDPublisher,3,Text,"~ It can also be useful to be able to identify the blade-like, first two labial palpal segments in long-",NA,NA,NA,NA
MMD,2022,"Danforth, Bryan, et al.",MMDPublisher,4,Text,"tongued bees as a tool for knowing whether you are examining a short-tongued or long-tongued
bee. But this is by no means essential for using the keys to the genera. Chapter 11 (Key to the ~
Families of North and Central America), however, makes heavy use of mouthpart characters ~
because these characters are defining features of the bee families. sl
MESOSOMA (Figs. 11-18) ~",NA,NA,NA,NA
MMD,2022,"Danforth, Bryan, et al.",MMDPublisher,4,Text,"MESOSOMA (Figs. 11-18) ~
The mesosoma is a compact structure consisting of sclerites of the pro-, meso- and ~
metathoracic segments, which bear the legs and wings, and the first true abdominal segment, WJ
termed the propodeum [Figs. 13 and 14]. The prothorax in bees is represented primarily by the
large pronotum, which extends laterally and meets ventrally behind the forecoxae, forming a ~",NA,NA,NA,NA
MMD,2022,"Danforth, Bryan, et al.",MMDPublisher,4,Text,"tubelike structure. The pronotal lobe is a useful landmark, and its shape and location may be used ~
in generic identification. The mesothorax and metathorax bear the wings and the second and is
third pairs of legs. In dorsal view [Fig. 14], the mesothorax can be divided into four distinct
sclerites: the scutum, the scutellum, and paired axillae. Dorsally, the metathorax consists of a ~",NA,NA,NA,NA
MMD,2022,"Danforth, Bryan, et al.",MMDPublisher,4,Text,"single sclerite, the metanotum. Laterally [Fig. 13], the mesothorax is represented by the ~
mesepisternum, sometimes referred to as the mesopleuron. The mesepisternum is sometimes ~
divided by the pre-episternal groove into the pre-episternum (or pre-episternal area) and the rest
of the mesepisternum. The shape and location of the pre-episternal groove, the scrobal groove, ~",NA,NA,NA,NA
MMD,2022,"Danforth, Bryan, et al.",MMDPublisher,4,Text,"and the scrobe are often important in generic identification. The metepisternum (or metapleuron) ~
forms the lateral surface of the metathorax. The wing bases are located above the upper margins ~
of the mesepisternum and the metepisternum. Js
<a
~
The form and subdivisions of the propodeum are not easy to illustrate but are exceedingly ~",NA,NA,NA,NA
MMD,2022,"Danforth, Bryan, et al.",MMDPublisher,4,Text,"important for identification. Many bees have a pair of impressed lines on the propodeum, Ww
beginning near the anterior dorsolateral parts of the propodeum and extending downward and
posteromesially and nearly meeting in the propodeal pit [Fig. 149], a median depression of the ~
lower posterior surface. These lines, together with the anterior dorsal margin of the propodeum, ~",NA,NA,NA,NA
MMD,2022,"Danforth, Bryan, et al.",MMDPublisher,4,Text,"enclose the triangular area, or propodeal triangle [Fig. 149]. Morphologically, this triangle is the ww
metapostnotum (Brothers 1976). The shape of the propodeum as seen in profile is quite
independent of the triangle. The whole propodeum may be vertical or nearly so, dropping from ~
the posterior margin of the metanotum. In this case it is termed declivous. However, as in Fig. ~",NA,NA,NA,NA
MMD,2022,"Danforth, Bryan, et al.",MMDPublisher,4,Text,"13, there may be a more or less horizontal basal region. In Fig. 13 it is separated by a sharp line, ~",NA,NA,NA,NA
MMD,2022,"Danforth, Bryan, et al.",MMDPublisher,5,Text,"~ or carina, from the declivous posterior surface. When such is the case, the horizontal part is
~ called the basal zone, or basal area, of the propodeum [Fig. 13]. It is part of the propodeal
~ triangle. The term ""basal area"" is applicable even if no
es sharp line separates the horizontal from the vertical
surfaces. In some bees the two surfaces are continuously",NA,NA,NA,NA
MMD,2022,"Danforth, Bryan, et al.",MMDPublisher,5,Text,"~ rounded, one onto the other in a broad curving surface; in
~ that case the term “basal area” is not definable unless there
~ is distinctive surface sculpturing.",NA,NA,NA,NA
MMD,2022,"Danforth, Bryan, et al.",MMDPublisher,5,Text,"Wings are illustrated, and the veins labeled, in
~ Figs. 15 and 16, using a modified Comstock and Needham
~ system. Because the homologies of the veins are not very
~ certain, as well as because some comparable-looking veins
- have very different morphological names, it has seemed",NA,NA,NA,NA
MMD,2022,"Danforth, Bryan, et al.",MMDPublisher,5,Text,"best to continue the use of some terms that are
~ morphologically noncommittal for certain cells and veins
ad heavily used in taxonomy. The names of cells and certain
e noncommittal names for veins are shown in Figs. 17 and
18.
~ Of special importance are three veins that all look
~ like crossveins: the second abscissa of Rs (or first",NA,NA,NA,NA
MMD,2022,"Danforth, Bryan, et al.",MMDPublisher,5,Text,"~ transverse cubital), first r-m (or second transverse cubital),
¥ and second r-m (or third transverse cubital), to use the
Comstock and Needham system. These veins help to
~ define the submarginal cells, which are usually either
~ three or two in number. It is important to note that
- submarginal cells can be variable within species. While",NA,NA,NA,NA
MMD,2022,"Danforth, Bryan, et al.",MMDPublisher,5,Text,"the vast majority of individuals within a species exhibit
~ the “typical” wing venation pattern for that species, there
~ are developmental anomalies that can result in non-
ww typical patterns of wing venation. Scarpulla (2018)
identified a number of such wing vein anomalies in
~ species of Colletidae, Andrenidae, Halictidae and
~ Apidae. These wing vein anomalies are commonly",NA,NA,NA,NA
MMD,2022,"Danforth, Bryan, et al.",MMDPublisher,5,Text,"~ expressed as a loss of the second transverse cubital vein
o in which a bee species that typically has three
submarginal cells instead has two. In some cases individuals can have normal wing venation on
~ one side of the body and non-typical wing venation on the other. If you suspect you have a
~ specimen with such a wing vein anomaly, the best solution is to compare it to other individuals",NA,NA,NA,NA
MMD,2022,"Danforth, Bryan, et al.",MMDPublisher,5,Text,= of the same species to verify what is the “normal” pattern.,NA,NA,NA,NA
MMD,2022,"Danforth, Bryan, et al.",MMDPublisher,5,Text,"Wings are described as though spread, so that the direction toward the costal margin
~ (where the stigma is in the forewing) is called anterior; toward the wing apex, distal. To save
~ space, the word stigma is used in place of pterostigma [Fig. 15].
~ The jugal and vannal lobes of the hind wing are both measured from the wing base to the",NA,NA,NA,NA
MMD,2022,"Danforth, Bryan, et al.",MMDPublisher,5,Text,"v apices of the lobes. Thus, on Fig. 18 one might say that the jugal lobe is about two-thirds as long",NA,NA,NA,NA
MMD,2022,"Danforth, Bryan, et al.",MMDPublisher,5,Text,as the vannal.,NA,NA,NA,NA
MMD,2022,"Danforth, Bryan, et al.",MMDPublisher,6,Text,"Some authorities advocate a system for identifying parts of legs that assumes that all legs ~
are pulled out laterally at right angles to the long axis of the body. Although we appreciate the ~
logic of that system, we follow the more traditional system in which the legs are considered to be ~
in their normal positions. Thus, we consider the corbicula of Apidae [Fig. 22] to be on the outer, eis",NA,NA,NA,NA
MMD,2022,"Danforth, Bryan, et al.",MMDPublisher,6,Text,"not the anterior, surface of the hind tibia, and we consider the two hind tibial spurs to be outer
and inner, not anterior and posterior. ~",NA,NA,NA,NA
MMD,2022,"Danforth, Bryan, et al.",MMDPublisher,6,Text,"The tibial spurs are the movable inferior apical spurs on the tibiae; the tibial spines are ”
immovable, sharp, superior, apical projections, usually small in size, found in some bees (see ~
Fig. 11 and Michener 1944). Description of the tibial spurs is important in many bees; this is ws
especially so of the inner hind tibial spur. This spur usually has two toothed margins. It is the",NA,NA,NA,NA
MMD,2022,"Danforth, Bryan, et al.",MMDPublisher,6,Text,"inner one that is commonly elaborated in various ways. It may be finely or coarsely serrate. ~
Following custom, we have described this margin as ciliate if it has slender, almost hairlike ~
projections (usually numerous), although in many cases the appearance is like that of a fine ¥
comb. Also following custom, we have described a spur as pectinate if its inner margin is",NA,NA,NA,NA
MMD,2022,"Danforth, Bryan, et al.",MMDPublisher,6,Text,"produced into a few long, coarse, often blunt projections [Fig. 154], even though the number of ~
such projections is in some cases reduced to only two or three. ~",NA,NA,NA,NA
MMD,2022,"Danforth, Bryan, et al.",MMDPublisher,6,Text,"The basitibial plate is a plate on the outer side of the ead
base of the hind tibia of many bees [Figs. 11, 174, and 175],
presumably important for support as bees move up or down we
their burrows in the soil. Commonly it is surrounded by a ~
carina or a sharp line of some sort and has vestiture (if any) —
different from that of adjacent regions, but it may be ws",NA,NA,NA,NA
MMD,2022,"Danforth, Bryan, et al.",MMDPublisher,6,Text,"indicated only by a series of tubercles, or even by a single
tubercle, and in some cases (as in Xvlocopa) its apex is ~
represented by a structure near the middle of the tibia. ~",NA,NA,NA,NA
MMD,2022,"Danforth, Bryan, et al.",MMDPublisher,6,Text,"On the inner surface of the hind tibia of most bees is w
an area of variable size covered with hairs of uniform length,
usually blunt or briefly bifid. These are called keirotrichia. ~

Between the tarsal claws there is often a protruding, ~
pad-like arolium (plural: arolia) [Fig. 12]. The arolium can Y
be lacking in some taxa, such as Megachile, Ptilothrix,

Euglossini, and Centridini. ~",NA,NA,NA,NA
MMD,2022,"Danforth, Bryan, et al.",MMDPublisher,6,Text,"The scopa (plural: scopae) is the pollen-carrying ~
brush of hairs. If such hairs surround a space in which pollen ~
is carried, they are said to form a corbicula. The best known w
corbicula is on the outer side of the hind tibia of Apidae, but
other corbiculae are on the underside of the hind femur of Andrenidae, Halictidae, Colletidae, ~",NA,NA,NA,NA
MMD,2022,"Danforth, Bryan, et al.",MMDPublisher,6,Text,"and others and on the side of the propodeum of many species of Andrena. In most bees the scopa bad
is on the hind legs, but in Megachilidae and some others it is on the underside of the metasoma. ww
Scopae are, of course, found only on nonparasitic females; in the keys, we do not state this fact
in every case. Scopae are absent in parasitic bees, in all male bees, in queens of highly social ~",NA,NA,NA,NA
MMD,2022,"Danforth, Bryan, et al.",MMDPublisher,6,Text,"bees, and in Hylaeus. teal",NA,NA,NA,NA
MMD,2022,"Danforth, Bryan, et al.",MMDPublisher,7,Text,"~ METASOMA (Figs. 19-22)
~ Each metasomal tergum or sternum (except for the anteriormost and the reduced apical
v ones) consists of a plate commonly marked by some transverse lines, as follows: (1) Across the
anterior margin, always completely hidden in the intact metasoma, is the antecosta. (2) Basal to",NA,NA,NA,NA
MMD,2022,"Danforth, Bryan, et al.",MMDPublisher,7,Text,"~ the middle of each plate is another transverse line, the gradulus (plural: graduli; Fig. 19). The
» ends of the tergal graduli, unless bent strongly to the rear, are usually near the spiracles. If bent
~ strongly to the rear, the resultant longitudinal lines are called lateral parts or lateral arms of the",NA,NA,NA,NA
MMD,2022,"Danforth, Bryan, et al.",MMDPublisher,7,Text,"graduli or, if carinate, lateral gradular carinae. The area anterior to the gradulus is usually at a
~ slightly higher level than that posterior to it, so that the gradulus is like a minute step. The
~ elevated, pre-gradular area provides a smooth surface for the anterior tergum or sternum to move
~ across as the metasoma moves and changes shape. The graduli are often concealed on the intact",NA,NA,NA,NA
MMD,2022,"Danforth, Bryan, et al.",MMDPublisher,7,Text,"- metasoma but, especially on the second tergum and sternum, are sometimes exposed. (3) Near
the posterior margin of each tergum and sternum is usually another transverse line, the
~ premarginal line, separating the posterior marginal area from the rest of the sclerite. This area is
w often depressed but in other cases differs only in sculpturing from the area basal to it.",NA,NA,NA,NA
MMD,2022,"Danforth, Bryan, et al.",MMDPublisher,7,Text,"we The pygidial plate [Fig. 19] is a usually flat plate, commonly surrounded by a carina or a
line and in some cases produced as an apical projection, on T6 of females or T7 of males. The
~ prepygidial fimbria is a dense band of hairs across the apex of T5 of females. It is conspicuously
~ different from, usually denser than, the apical hair bands or fasciae of preceding terga. Dense",NA,NA,NA,NA
MMD,2022,"Danforth, Bryan, et al.",MMDPublisher,7,Text,"~ hairs on T6 of females, on each side of the pygidial plate, constitute the pygidial fimbria [Fig.
ko 19].
~ The genital capsule [Fig. 20] as well as S7 and S8
¥ [Figs. 21, 22] of male bees exhibit many diagnostic characters
and may be dissected out for study (in fact, for some groups,
~ species-level identifications may require examination of male",NA,NA,NA,NA
MMD,2022,"Danforth, Bryan, et al.",MMDPublisher,7,Text,"~~ S7, S8 or the genital capsule). In some groups the sixth, fifth,
~ and even the fourth sterna are also hidden and modified. On a
freshly relaxed specimen it is usually possible to reach between the apical exposed tergum and
~ sternum and, with a hooked needle, pull out the genitalia and hidden sterna. In most cases such",NA,NA,NA,NA
MMD,2022,"Danforth, Bryan, et al.",MMDPublisher,8,Text,"~~
dissection is not difficult, but in the Megachilidae the numerous hidden sterna are firmly
connected to one another and to the terga laterally and are often delicate medially, so that ~
successful dissection may be difficult. Beginners should start with other groups. Y
For gross observations, sterna and genitalia may be preserved dry, glued to a card on the Ww",NA,NA,NA,NA
MMD,2022,"Danforth, Bryan, et al.",MMDPublisher,8,Text,"pin with the specimen. For more detailed study, they should be immersed in a solution of 10%
sodium or potassium hydroxide to remove the muscle tissue, then washed in water, and placed
for study in glycerin, and transferred for preservation to microvials, kept with the specimen by ~
running the pin through the stopper. Preservation on slides has the disadvantage of making side ww",NA,NA,NA,NA
MMD,2022,"Danforth, Bryan, et al.",MMDPublisher,8,Text,"views impossible, as well as crushing the genitalia, which are often quite thick. Y
_
-_
~~
~~
~~
-_
-_
~~
~
~~
~~
-_
—
~
—_—
-—
~_
~
~
—_—",NA,NA,NA,NA
MMD,2022,"Danforth, Bryan, et al.",MMDPublisher,9,Text,"~ Chapter 12 -- Notes on the genera

~ [updated 07/08/22 BND JLN]

ww The notes below are intended to supplement the keys in that they should help the user decide
whether they have successfully identified a specimen to genus. The notes are organized

~ according to the classification of bee genera presented in Table 2-1. The brief family",NA,NA,NA,NA
MMD,2022,"Danforth, Bryan, et al.",MMDPublisher,9,Text,"baad characterizations, as well as the “Key to the Families,” are probably accurate for our area but not

w necessarily worldwide. For a worldwide treatment of genera, see Michener (2007).

~ DESCRIPTIVE TERMS. For each genus, there are comments on appearance and sometimes on

~ distinguishing features other than those noted in the keys. General body shape is described in",NA,NA,NA,NA
