id,left_text,left_target,right_text,right_target,left_target_info,right_target_info,parent
sec63-1-1,"Malar space at least half as long as wide (apical tergal hair bands absent except sometimes at sides of T1 and T2; head only slightly, if any, wider than long)",sec63-1-2,Malar space nearly absent,sec63-1-3,,,
sec63-1-2,"Metanotum with median tubercle or projection (weak in Mellitidia simplicinotum Michener); mandible of female three-toothed; inner hind tibial spur of female pectinate with two large, broad teeth (Fig. 63-2k) (New Guinea region)",Mellitidia,"Metanotum strongly convex, slightly depressed medially, without median tubercle; mandible of female twotoothed; inner hind tibial spur of female minutely ciliateserrate (as in Fig. 63-2f) (New Guinea)",Ptilonomia,Mellitidia,Ptilonomia,sec63-1-1
sec63-1-3,"Ocelli enlarged, ocellocular distance equal to or less than ocellar diameter; hind wing with dark area (due to dense minute hairs) along costal margin between hamuli and wing tip (body partly brown or testaceous; scutellum of male bituberculate) (New Guinea region)",Reepenia,"Ocelli not or only slightly enlarged, ocellocular distance greater than ocellar diameter; hind wing without dark area",sec63-1-4,Reepenia,,sec63-1-1
sec63-1-4,"Marginal zones of T2 to T4 (or, in males, to T5), and often also T1, except near bases, hairless, impunctate, usually opaque white, yellow, green, or blue, although sometimes concolorous with rest of metasoma, the frequently opalescent bands sometimes broken medially (basal area of propodeum subhorizontal to vertical, sometimes incompletely distinguished from rest of propodeal triangle; anterior end of scutum not or only medially bent sharply down to meet pronotum; pronotum not lamellate)",Nomia (in part),"Marginal zones of T1 to T4 variable, often hairy or punctate, and if impunctate, then often translucent, sometimes only that of T4 hairy or punctate, the zones never white, yellow, green, or blue",sec63-1-5,Nomia (in part),,sec63-1-3
sec63-1-5,"T egula enormous, extending well behind level of scutoscutellar suture (Fig. 63-4o) and preoccipital carina present; anterior end of scutum medially bent sharply downward, the angle sharp and commonly carinate (pronotum with strong, translucent lamella from posterior lobe mesad)",Pseudapis,"T egula not reaching level of scutoscutellar suture, or, if enlarged as above, then preoccipital carina absent; anterior end of scutum, if bent sharply downward, without sharp angle or carina along bend",sec63-1-6,Pseudapis,,sec63-1-4
sec63-1-6,"Submarginal cells two; males and some females with translucent lamella on dorsolateral angle of pronotum, the lamella extending continuously mesad as carina all across pronotum; tegula large as in Pseudapis (Fig. 634o); mesepisternum of male, mesal to middle coxa, with tubercle or spine; antenna of male with last two segments enlarged and ﬂattened, not pedunculate (African, oriental)",Steganomus,,,Steganomus,,sec63-1-5
